{
  "schema": "collectorx.event.v1",
  "id": "notes:obsidian:research/maotai.md",
  "collector": "notes",
  "source": "Obsidian vault research/maotai.md",
  "owner_scope": "personal",
  "kind": "note",
  "time": "2026-07-07T11:30:00+08:00",
  "collected_at": "2026-07-07T15:00:00+08:00",
  "data": {
    "title": "贵州茅台跟踪",
    "path": "research/maotai.md",
    "content": "核心假设：渠道库存和批价是短期观察变量。",
    "tags": ["投资研究", "白酒"]
  },
  "raw_ref": {
    "file": "research/maotai.md"
  },
  "privacy": {
    "sensitive": true,
    "local_only": true,
    "contains": ["portfolio"]
  },
  "wiki_targets": [
    "investor.competence_circle.industries",
    "investor.research_process",
    "investor.decision_framework"
  ]
}
